{
  "$schema": "./participant-surface-v1.schema.json",
  "schema_version": "1.0.0",
  "artifact_type": "CLOSED_WORLD_PARTICIPANT_SURFACE",
  "artifact_id": "PARTICIPANT-SURFACE-V1",
  "status": "FROZEN_UNEXECUTED_DEVELOPMENT_SURFACE",
  "authority": "PARTICIPANT_REALIZATION_ONLY_NO_SEMANTIC_SOURCE_AUTHORITY",
  "canonicalization_profile_id": "HM-CANONICAL-JSON-PY-V1",
  "renderer_semantics_version": "INTERP-DIALOGUE-P0-V1-RENDERER-1.0.0",
  "semantic_source_bindings": [
    {
      "artifact_id": "REL-BOUNDARY-001",
      "path": "research/scenarios/interp-dialogue-001/families/rel-boundary.json",
      "content_sha256": "4eb342e655ded940ab8537f4e7827692829967a35f17feb375e731a24d2750e2"
    },
    {
      "artifact_id": "WORK-FEEDBACK-001",
      "path": "research/scenarios/interp-dialogue-001/families/work-feedback.json",
      "content_sha256": "71cedb46667d1fc2ab76ee1e9711e8f0344e3fea6cf9bd16b577643d292d5823"
    },
    {
      "artifact_id": "RISK-FOOTSTEPS-001",
      "path": "research/scenarios/interp-dialogue-001/families/risk-footsteps.json",
      "content_sha256": "4fbe69cbe8bd8edb631c9012810dbf935b69f10d5afa7c670638177eabb2a256"
    },
    {
      "artifact_id": "INTERP-DIALOGUE-001B-TRACE-ORACLE-V1",
      "path": "research/scenarios/interp-dialogue-001/trace-oracle-v1.json",
      "content_sha256": "9caefdf39b9ac41c355f8afed0f4c5d0f780499f571346ef2a7042fa30da74b9"
    }
  ],
  "rendering_grammar": {
    "initial_joiner": "\n\nContext:\n",
    "factor_line_prefix": "- ",
    "factor_joiner": "\n",
    "factor_order_authority": "FROZEN_001A_FACTOR_ARRAY_ORDER"
  },
  "base_surfaces": [
    {
      "surface_realization_id": "SURFACE-BASE-REL-BOUNDARY-001",
      "family_id": "REL-BOUNDARY-001",
      "participant_text": "The partner says: I want to be alone for a while today. I will contact you tomorrow.",
      "semantic_change_classification": "REFERENT_CLARIFICATION",
      "basis_refs": [
        {
          "artifact_id": "INTERP-DIALOGUE-001P0-ELICITATION-INSTRUMENT-V0",
          "artifact_path": "research/scenarios/interp-dialogue-001/elicitation/instrument-v0.json",
          "artifact_sha256": "52705bc686a69d43360eb0544eda59571c77dc1e29520ec4b156bcd60f413776",
          "json_pointer": "/rendering_policy/base_surface_by_family/0/participant_text",
          "value_canonical_sha256": "1ff7ece4d07bccb67abf0f095a474bfbf6faf0df44e83afce2af1f12a9263bd6",
          "canonicalization_profile_id": "HM-CANONICAL-JSON-PY-V1",
          "digest_domain": "HM-REVISION-BASIS-JSON-V1"
        }
      ],
      "resolution_candidate_refs": [
        "RC-RP002-PARTNER"
      ],
      "required_semantic_elements": [],
      "prohibited_construct_labels": []
    },
    {
      "surface_realization_id": "SURFACE-BASE-WORK-FEEDBACK-001",
      "family_id": "WORK-FEEDBACK-001",
      "participant_text": "The evaluator says: The direction is good, but this result did not meet expectations.",
      "semantic_change_classification": "UNCHANGED_SOURCE_REALIZATION",
      "basis_refs": [
        {
          "artifact_id": "INTERP-DIALOGUE-001P0-ELICITATION-INSTRUMENT-V0",
          "artifact_path": "research/scenarios/interp-dialogue-001/elicitation/instrument-v0.json",
          "artifact_sha256": "52705bc686a69d43360eb0544eda59571c77dc1e29520ec4b156bcd60f413776",
          "json_pointer": "/rendering_policy/base_surface_by_family/1/participant_text",
          "value_canonical_sha256": "269d0c99fef75c07e3f0ef412f0f5bcd513d55af9863dc13be7d82dcea3ab561",
          "canonicalization_profile_id": "HM-CANONICAL-JSON-PY-V1",
          "digest_domain": "HM-REVISION-BASIS-JSON-V1"
        }
      ],
      "resolution_candidate_refs": [],
      "required_semantic_elements": [],
      "prohibited_construct_labels": []
    },
    {
      "surface_realization_id": "SURFACE-BASE-RISK-FOOTSTEPS-001",
      "family_id": "RISK-FOOTSTEPS-001",
      "participant_text": "At night on a public route, footsteps are audible behind the walker; their source is not visible.",
      "semantic_change_classification": "UNCHANGED_SOURCE_REALIZATION",
      "basis_refs": [
        {
          "artifact_id": "INTERP-DIALOGUE-001P0-ELICITATION-INSTRUMENT-V0",
          "artifact_path": "research/scenarios/interp-dialogue-001/elicitation/instrument-v0.json",
          "artifact_sha256": "52705bc686a69d43360eb0544eda59571c77dc1e29520ec4b156bcd60f413776",
          "json_pointer": "/rendering_policy/base_surface_by_family/2/participant_text",
          "value_canonical_sha256": "dfeea05284b403bdab9b7bd51dae9fe3f19e29d914e84000d9b4a247a243547c",
          "canonicalization_profile_id": "HM-CANONICAL-JSON-PY-V1",
          "digest_domain": "HM-REVISION-BASIS-JSON-V1"
        }
      ],
      "resolution_candidate_refs": [],
      "required_semantic_elements": [],
      "prohibited_construct_labels": []
    }
  ],
  "factor_level_surfaces": [
    {
      "surface_realization_id": "SURFACE-FACTOR-REL-BOUNDARY-001-reported_ordinary_mood",
      "family_id": "REL-BOUNDARY-001",
      "participant_text": "Just before hearing the partner's request, the recipient says their mood feels ordinary.",
      "semantic_change_classification": "SEMANTIC_PRESERVATION_UNVERIFIED",
      "basis_refs": [
        {
          "artifact_id": "REL-BOUNDARY-001",
          "artifact_path": "research/scenarios/interp-dialogue-001/families/rel-boundary.json",
          "artifact_sha256": "4eb342e655ded940ab8537f4e7827692829967a35f17feb375e731a24d2750e2",
          "json_pointer": "/factors/0/levels/0/descriptor",
          "value_canonical_sha256": "d7199f93c1ce43d30750ece7e04a27c208266035fc6d7038b5f30607f557c972",
          "canonicalization_profile_id": "HM-CANONICAL-JSON-PY-V1",
          "digest_domain": "HM-REVISION-BASIS-JSON-V1"
        }
      ],
      "resolution_candidate_refs": [
        "RC-RP006-REL-ORDINARY"
      ],
      "required_semantic_elements": [],
      "prohibited_construct_labels": [],
      "factor_id": "reported_current_mood",
      "level_id": "reported_ordinary_mood"
    },
    {
      "surface_realization_id": "SURFACE-FACTOR-REL-BOUNDARY-001-reported_low_mood",
      "family_id": "REL-BOUNDARY-001",
      "participant_text": "Just before hearing the partner's request, the recipient says their mood feels low.",
      "semantic_change_classification": "SEMANTIC_PRESERVATION_UNVERIFIED",
      "basis_refs": [
        {
          "artifact_id": "REL-BOUNDARY-001",
          "artifact_path": "research/scenarios/interp-dialogue-001/families/rel-boundary.json",
          "artifact_sha256": "4eb342e655ded940ab8537f4e7827692829967a35f17feb375e731a24d2750e2",
          "json_pointer": "/factors/0/levels/1/descriptor",
          "value_canonical_sha256": "5398d3081494e226e54f57c997ce2156e67765253f0fa1cbf81ee861789ba720",
          "canonicalization_profile_id": "HM-CANONICAL-JSON-PY-V1",
          "digest_domain": "HM-REVISION-BASIS-JSON-V1"
        }
      ],
      "resolution_candidate_refs": [
        "RC-RP006-REL-LOW"
      ],
      "required_semantic_elements": [],
      "prohibited_construct_labels": [],
      "factor_id": "reported_current_mood",
      "level_id": "reported_low_mood"
    },
    {
      "surface_realization_id": "SURFACE-FACTOR-REL-BOUNDARY-001-reliable_followthrough_history",
      "family_id": "REL-BOUNDARY-001",
      "participant_text": "Across comparable prior boundary requests, this partner usually resumed contact when they said they would.",
      "semantic_change_classification": "UNCHANGED_SOURCE_REALIZATION",
      "basis_refs": [
        {
          "artifact_id": "REL-BOUNDARY-001",
          "artifact_path": "research/scenarios/interp-dialogue-001/families/rel-boundary.json",
          "artifact_sha256": "4eb342e655ded940ab8537f4e7827692829967a35f17feb375e731a24d2750e2",
          "json_pointer": "/factors/1/levels/0/descriptor",
          "value_canonical_sha256": "2a33db19a7debf70e36cc55c47c6573c3942c78024c0900e1d381e7675226fe0",
          "canonicalization_profile_id": "HM-CANONICAL-JSON-PY-V1",
          "digest_domain": "HM-REVISION-BASIS-JSON-V1"
        }
      ],
      "resolution_candidate_refs": [],
      "required_semantic_elements": [],
      "prohibited_construct_labels": [],
      "factor_id": "target_history",
      "level_id": "reliable_followthrough_history"
    },
    {
      "surface_realization_id": "SURFACE-FACTOR-REL-BOUNDARY-001-unexplained_withdrawal_history",
      "family_id": "REL-BOUNDARY-001",
      "participant_text": "Across comparable prior boundary requests, this partner repeatedly promised later contact and then remained unavailable without explanation.",
      "semantic_change_classification": "UNCHANGED_SOURCE_REALIZATION",
      "basis_refs": [
        {
          "artifact_id": "REL-BOUNDARY-001",
          "artifact_path": "research/scenarios/interp-dialogue-001/families/rel-boundary.json",
          "artifact_sha256": "4eb342e655ded940ab8537f4e7827692829967a35f17feb375e731a24d2750e2",
          "json_pointer": "/factors/1/levels/1/descriptor",
          "value_canonical_sha256": "e46e68f4cf5d0f03828bcf680b12554e650e5bf4d7d43e1a64c735d13a88b472",
          "canonicalization_profile_id": "HM-CANONICAL-JSON-PY-V1",
          "digest_domain": "HM-REVISION-BASIS-JSON-V1"
        }
      ],
      "resolution_candidate_refs": [],
      "required_semantic_elements": [],
      "prohibited_construct_labels": [],
      "factor_id": "target_history",
      "level_id": "unexplained_withdrawal_history"
    },
    {
      "surface_realization_id": "SURFACE-FACTOR-REL-BOUNDARY-001-cue_prior_small_care",
      "family_id": "REL-BOUNDARY-001",
      "participant_text": "An earlier occasion when the partner noticed a need and followed through is mentioned again.",
      "semantic_change_classification": "SEMANTIC_PRESERVATION_UNVERIFIED",
      "basis_refs": [
        {
          "artifact_id": "REL-BOUNDARY-001",